{
  "schema_version": "2.0.0",
  "id": "sess_espresso_taste_001",
  "workspace_id": "ws_corpus",
  "title": "Espresso taste complaint",
  "status": "active",
  "phase": "causal",
  "revision": 9,
  "active_frame_id": "frame_espresso_repeatability",
  "statements": [
    {
      "id": "stmt_espresso_001",
      "text": "My espresso is not like an Italian espresso.",
      "primary_role": "observation",
      "status": "proposed",
      "provenance": {
        "kind": "observed",
        "source_ids": [
          "intake_espresso_t0001"
        ],
        "note": "Complaint as it arrived."
      }
    },
    {
      "id": "stmt_espresso_002",
      "text": "There is one Italian espresso specification to compare against.",
      "primary_role": "assumption",
      "status": "proposed",
      "provenance": {
        "kind": "inferred",
        "source_ids": [
          "stmt_espresso_001"
        ],
        "note": "Hidden reference carried by the intake wording."
      }
    },
    {
      "id": "stmt_espresso_003",
      "text": "Shots taste sour on some occasions, bitter and harsh on others, and flat with no crema.",
      "primary_role": "observation",
      "status": "proposed",
      "provenance": {
        "kind": "observed",
        "source_ids": [],
        "note": "What IS."
      }
    },
    {
      "id": "stmt_espresso_004",
      "text": "Which taste appears varies randomly from shot to shot.",
      "primary_role": "observation",
      "status": "proposed",
      "provenance": {
        "kind": "observed",
        "source_ids": [],
        "note": "Extent IS."
      }
    },
    {
      "id": "stmt_espresso_005",
      "text": "Sourness and bitterness occur in different shots, never in the same sip.",
      "primary_role": "observation",
      "status": "proposed",
      "provenance": {
        "kind": "observed",
        "source_ids": [],
        "note": "What IS NOT: no mixed sour-and-bitter cup."
      }
    },
    {
      "id": "stmt_espresso_006",
      "text": "The same coffee also tasted bad when brewed at a bar.",
      "primary_role": "observation",
      "status": "superseded",
      "provenance": {
        "kind": "observed",
        "source_ids": [],
        "note": "First answer; contradicted by stmt_espresso_007 and kept, never deleted."
      }
    },
    {
      "id": "stmt_espresso_007",
      "text": "The same pre-ground bag, brewed by a barista at a bar, tasted fine.",
      "primary_role": "observation",
      "status": "proposed",
      "provenance": {
        "kind": "observed",
        "source_ids": [],
        "note": "Where IS NOT, after the contradiction was resolved with the person."
      }
    },
    {
      "id": "stmt_espresso_008",
      "text": "The coffee is supermarket pre-ground and carries no roast date.",
      "primary_role": "observation",
      "status": "proposed",
      "provenance": {
        "kind": "observed",
        "source_ids": [],
        "note": "When: needs more data; age cannot be established."
      }
    },
    {
      "id": "stmt_espresso_009",
      "text": "The home machine is a compact thermoblock pump machine used with a pressurized single-hole basket.",
      "primary_role": "observation",
      "status": "proposed",
      "provenance": {
        "kind": "observed",
        "source_ids": []
      }
    },
    {
      "id": "stmt_espresso_010",
      "text": "The machine has not been descaled for a long time, possibly never.",
      "primary_role": "observation",
      "status": "proposed",
      "provenance": {
        "kind": "observed",
        "source_ids": [],
        "note": "Change near the deviation."
      }
    },
    {
      "id": "stmt_espresso_011",
      "text": "What are the shot time, the quantity in the cup and their spread over several shots?",
      "primary_role": "question",
      "status": "proposed",
      "provenance": {
        "kind": "observed",
        "source_ids": [],
        "note": "Extent: needs more data."
      }
    },
    {
      "id": "stmt_espresso_012",
      "text": "The drinker consistently enjoys the cup, judged against a reference they declare.",
      "primary_role": "outcome",
      "status": "proposed",
      "provenance": {
        "kind": "inferred",
        "source_ids": [
          "stmt_espresso_001"
        ]
      }
    }
  ],
  "ladder": [
    {
      "id": "rung_espresso_component",
      "abstraction_level": "component",
      "outcome": "The machine brews within its own specification.",
      "scope": "Pump, thermoblock, basket and portafilter.",
      "system_boundary": "component",
      "success_measures": [
        "brew temperature stability",
        "flow through the basket"
      ],
      "assumptions": [
        "the coffee is fit for espresso"
      ],
      "loss": "Coffee, water, routine and the drinker's reference are out of view.",
      "provenance": {
        "kind": "inferred",
        "source_ids": [
          "stmt_espresso_001"
        ]
      }
    },
    {
      "id": "rung_espresso_subsystem",
      "abstraction_level": "subsystem",
      "outcome": "Extraction is repeatable from shot to shot.",
      "scope": "Coffee bed, water path, pressure and temperature during one shot.",
      "system_boundary": "subsystem",
      "success_measures": [
        "spread of shot time",
        "spread of cup quantity",
        "crema present and persistent"
      ],
      "assumptions": [
        "the reference cup is taken as given"
      ],
      "loss": "Purchasing, maintenance and the experienced cup are treated as fixed inputs.",
      "provenance": {
        "kind": "inferred",
        "source_ids": [
          "stmt_espresso_001"
        ]
      }
    },
    {
      "id": "rung_espresso_system",
      "abstraction_level": "system",
      "outcome": "The home routine, from buying coffee to descaling, delivers the reference cup.",
      "scope": "Purchase, storage, preparation, brewing, water and maintenance at home.",
      "system_boundary": "operations",
      "success_measures": [
        "share of shots judged acceptable",
        "maintenance interval kept"
      ],
      "assumptions": [
        "the drinker can change the routine"
      ],
      "loss": "Single-shot physics becomes one lever among several; measures become slower to observe.",
      "provenance": {
        "kind": "inferred",
        "source_ids": [
          "stmt_espresso_001"
        ]
      }
    },
    {
      "id": "rung_espresso_product",
      "abstraction_level": "product",
      "outcome": "The drinker consistently enjoys the cup against a declared reference.",
      "scope": "The cup as experienced: taste, crema, temperature, context and expectation.",
      "system_boundary": "product",
      "success_measures": [
        "drinker rating against the declared reference"
      ],
      "assumptions": [
        "the reference can be declared"
      ],
      "loss": "Measures become partly sensory and the causes are far from the measure.",
      "provenance": {
        "kind": "inferred",
        "source_ids": [
          "stmt_espresso_001",
          "stmt_espresso_012"
        ]
      }
    }
  ],
  "frames": [
    {
      "id": "frame_espresso_reference",
      "question": "Which espresso reference is the drinker comparing against, and by how much does the cup deviate from it?",
      "outcome": "A declared reference and a measured deviation from it.",
      "abstraction_level": "product",
      "system_boundary": "product",
      "included": [
        "reference parameter set",
        "sensory description"
      ],
      "excluded": [
        "machine internals"
      ],
      "success_measures": [
        "deviation per measure against the reference"
      ],
      "constraints": [
        "home budget"
      ],
      "assumptions": [
        "one reference can be chosen"
      ],
      "open_questions": [
        "INEI or Comitato parameters, or the drinker's own bar?"
      ],
      "status": "proposed",
      "digest": "sha256:fb899521fc462862460a1069cb86eded416ee3f89d53fb537b22d49116b0d467"
    },
    {
      "id": "frame_espresso_supply",
      "question": "Is the coffee as bought fit for espresso?",
      "outcome": "Coffee whose age and grind suit espresso.",
      "abstraction_level": "system",
      "system_boundary": "supply_chain",
      "included": [
        "bean origin and roast",
        "age and packaging",
        "pre-ground versus whole bean"
      ],
      "excluded": [
        "machine",
        "water"
      ],
      "success_measures": [
        "crema present with fresh coffee"
      ],
      "constraints": [
        "supermarket purchase"
      ],
      "assumptions": [
        "the bar result implicates the coffee"
      ],
      "open_questions": [
        "Rejected after stmt_espresso_007: the same bag brewed fine at a bar."
      ],
      "status": "rejected",
      "digest": "sha256:49ffa7b94c64424a749218b02a1aeda640bc11e12cd46dc9b4ffc5022141d989"
    },
    {
      "id": "frame_espresso_repeatability",
      "question": "Why does extraction on the home machine vary from shot to shot?",
      "outcome": "Repeatable extraction on the home machine.",
      "abstraction_level": "subsystem",
      "system_boundary": "subsystem",
      "included": [
        "temperature",
        "pressure and flow",
        "basket",
        "scale in the water path",
        "dose and tamp"
      ],
      "excluded": [
        "coffee purchase",
        "drinker reference"
      ],
      "success_measures": [
        "spread of shot time",
        "spread of cup quantity",
        "crema present"
      ],
      "constraints": [
        "no new machine"
      ],
      "assumptions": [
        "the coffee can brew a good shot, per stmt_espresso_007"
      ],
      "open_questions": [
        "Shot time and quantity spread are not yet measured (stmt_espresso_011)."
      ],
      "status": "working",